objectid,filename,format,title,date,subject,location,latitude,longitude,source,language,landonsource,barthatext,landontext,
jhdoc0001,,record,"Joseph Haydn to Melchior Griessler, Eisenstadt, 4 March 1762",1762-03-04,"Joseph Haydn;Melchior Griessler;Nikolaus I, Prince Esterházy;singers;bass singers;violinists",Vienna,48.207303,16.374138,"Bartha GBA no. 2; Landon Chronicle I, pp. 366-7",ger,,"Befel-schreiben des Capel-Meisters an Melchiorem Grießler Bassisten und Violinisten aus Wienn den 4ten Merzen 1762 ergangen: Wohl Edler, Geehrter herr! Nachdeme des Fürsten Durchlaucht den vorigen ganzen Sommer dahier gewesen, folglich des Herrn seine diensten leistung nur in der dortigen Chor-Musique bestanden, als wolle nun hochdieselbe zu dero Cammer-Musique den herrn, lauth hinaus gegeneber Convention, dahier brauchen, und alß habe den Befehl erhalten dem [Herrn] zu schreiben, das derselbe nach empfang dises brieffes, sich hieher verfügen, auch auf etliche monath (das ist zu verstehen, so lang, bis die hohe Herrschaft nach Eisenstadt wird abgehen) mit quartier, und Kost versehen solle. Welches zu folge des mir ertheilten befehls hiemit berichte, und verbleibe des [Herrn]. Wienn den 4ten Merzen / 1762. Bereitwilligster diener Heydn Capell-/Meister.","Letter which the Capel-Meister was ordered to write to Melchior Griessler, bass singer and violinist, sent from Vienna on 4th March 1762. Most noble, respected Sir! Inasmuch as His Princely Highness was here in Vienna for the whole of the last summer, the services rendered by you, Sir, consisted only in the choir musique there [at Eisenstadt]; but now His Highness, according to a decree [Convention] issued, wishes to have you as a part of his chamber musique, and thus needs you here [in Vienna]; and therefore I have received the order to write you, Sir, that upon receipt of this letter, you are to come here, also for several months (this is to be understood as meaning the length of time before the high Herrschaft departs for Eisenstadt), for which period there will be provided lodging and food. Which, as a result of the order given to me, I herewith communicate and remain, Your most obedient Servant, Heydn Capell-Meister.",
jhdoc0002,,record,"Joseph Haydn to Nikolaus I, Prince Esterházy, Eisenstadt, 9 September 1765",1765-09-09,"Joseph Haydn;Nikolaus I, Prince Esterházy;Franz Siegl;Peter Ludwig von Rahier;Carl Friberth;imprisonment;punishment;flautist",Eisenstadt,47.840734,16.524253,Bartha GBA no. 3; Landon CCLN pp. 3-4,ger,"autograph, Esterházy Archives Acta Musicalia I, 49","DURCHLEUCHTIG HOCH GEBOHRNER REICHSFÜRST. GNÄDIGST HOCHGEBIETTENDER HERR HERR! EUER HOCHFÜRSTLICHEN DURCHLAUCHT untern 8ten dieses an mich abgeschicktes schreiben habe mit all: unterhänigst gehorsamsten Respect erhalten, und daraus ersehen, wie das Hochderoselben sehr ungnädig genohmen, daß ich wider die Arretirung des Flautroversistens Frantz Sigl bey Herrn v. Rahier protestiret, und hinführe dessen Befehlen bey zu beförchten habender HOCHFÜRSTLICHEN ungnaden besser nach zu leben ermahnet werde. DURCHLEUCHTIG FÜRST! GNÄDIGSTER HERR! Es ist deme [?], daß mich weegen erst benannten Flautroversisten, durch welchen das Feuer entstanden mit gesamter Musique zu den Herrn v. Rahier begeben, habe jedoch nicht weegen Arretirung, sondern nur weegen der unartigen Arretirung, und harten Verfarhen gegen den einführenden [?] doch mit allen gegen Herrn. v. Rahier gebührenden Respect protestiret, Es ware aber bey Ihme Hernn Regenten mit nichten was auszurichten, sondern müste selbsten noch erfahren, daß er mir die Thüre vor dem angesicht zu geschlagen, die übrige gesamte per Ihr tractiret, und allen den Arrest angedrohet hat, gleichewie heuntigen tag noch dem Friberth, deme herrn Regent (weegen nicht abgenohmenen Huth, so aus übersehung geschehen seyn müste) passioniret, in flüchten umgeht, und sich aus Forcht annoch Arretiret zu werden, nicht nacher haus zu komen getraut, indeme gedachter Herr Regent vorschützen will, daß erst bemelter Friberth Ihme eine Grobheit angethan, dauor aber sich selbsten Satisfaction nehmen wolle. Ich bezeige es aber samt denen übrigen Musicis, daß der Friberth nichts anderes, wie Herr Regent allen sammentlich mit der Arretirung, und zwar ohne ursach gedrohet, gesprochen, er habe keinen anderen Herrn als SEINE DURCHLAUCHT FÜRSTEN ESTERHAZY: Ich selbsten vermeldete Herrn Regenten, wan selbter an eigener Persohn beleydiget worden, bey EUER HOCHFÜRSTLICHEN DURCHLAUCHT Satisfaction anverlangen solle, allein ich muste in andworth hören, daß Herr Regent sein eigener Richter seyn, und sich selbst Satisfaction verschaffen wolle. die leuthe seynd derohalben sehr bestürtzt, und fallet denen Ehrliebenden dieses Tractament sehr beschwerlich, und hoffen, daß EUER HOCHFÜRSTLICHEN DURCHLAUCHT gnädigste gesinnungen dahin sich gewis nicht erstrecken, und eben derowegen ein solches Potere, wo ein jeder sein eigener Richter ohne unterscheid des schuldig oder unschuldigen seyn kan, gnädigst einstellen werden. Die Befehle des oft gedachten Herrn Regentens (wie EUER HOCHFÜRSTLICHEN DURCHLAUCHT ohnediss beckant) seynd allzeit richtig vollzohen worden, so oft ich nur durch demeselben EUER HOCHFÜRSTLICHEN DURCHLAUCHT ordre erhalten, werde auch allzeit deneselben nachzukomen beflissen seyn; wan also Herr Regent hierinfahls sich beschwehret hätte, mus es nur der zornigen federn zugemuethet werden. Übrigens aber werden EUER HOCHFÜRSTLICHEN DURCHLAUCHT selbst allergnädigst ermessen, daß ich zweyen Herren nicht dienen, und eben also Herrn Regentens eigene Befehle nicht annehmen, und mich Ihme unterthänig machen könne, allermassen EUER HOCHFÜRSTLICHEN DURCHLAUCHT selbsten dereinstens zu mir gemeldet: führohin komme er zu mir, dan Ich bin sein Herr. Bin also getröstet, daß EUER HOCHFÜRSTLICHEN DURCHLAUCHT dieses mein unterthänigst gehorsamstes schreiben nicht ungnädig aufnehmen, sondern mich und die ganzte Musique mit gnädigen Augen ansehen, und da derselben jederman mißgünstig ist, vätterlich protegiren werden. der mich zu ferneren HOCHFÜRSTLICHEN Hulden und Gnaden unterthänigst gehorsamt reccommendire und mit all: Submissesten Respect ersterbe. EUER HOCHFÜRSTLICHEN DURCHLAUCHT Unterthänigst Gehorsamster, Josephus Haydn. Eisenstadt den 9ten 7bris [Sept.] 1765.","SERENE HIGHNESS AND NOBLE PRINCE OF THE HOLY ROMAN EMPIRE, GRACIOUS AND DREAD LORD! I have received with every submission and dutiful respect YOUR ILLUSTRIOUS AND SERENE HIGHNESS’ letter of the 8th inst. Addressed to me, and I see from it that Your Highness has taken it very amiss that I protested against the detention of the flauto traverso player Frantz Sigl to Herr von Rahier, whose commands I am now admonished to follow, in order that I may behave better in the future, on the penalty of the dread displeasure of my SERENE HIGHNESS. MOST SERENE HIGHNESS! GRACIOUS LORD! On behalf of the abovenamed flauto traverso player, because of whom the fire started, I went with the whole band to Herr von Rahier, and it was not on account of the detention, but only on account of the rude detention and the hard treatment of the subject that I protested, but with all proper respect, to Herr von Rahier. But we could not get anywhere with the administrator, and I even had to put up with his slamming the door in my face, he pushed all the others out, and threatened everyone with detention. Similarly, this very day Friberth fled excitedly from the administrator (on account of not doffing his hat, which must have been an oversight), and does not dare to come home, because this same administrator pretends that the first-mentioned Friberth was rude to him, and that therefore he will mete out his own punishment. But I testify, as do all the other musicians, that Friberth did nothing else except that, when the administrator threatened all of us with detention—and without any reason—he said he had no other master but HIS SERENE HIGHNESS, PRINCE ESTERHÁZY. I myself told the administrator to complain to YOUR SERENE AND ILLUSTRIOUS HIGHNESS if he felt his own person to have been insulted partner but I was given the answer that the administrator is his own judge and will mete out the punishment himself. Everyone is very upset on this account, they find this treatment very unfair and hope that YOUR SERENE AND GRACIOUS HIGHNESS’ intentions certainly do not extend this far, and that for this reason you will graciously put a stop to such a procedure [“Potere”] whereby anyone can be his own judge without differentiating between guilty or not guilty. The orders of the oft-mentioned administrator (as YOUR SERENE AND GRACIOUS HIGHNESS knows anyway) Have been correctly carried out at all times, and as often as I receive through him an order of YOUR SERENE AND GRACIOUS HIGHNESS, I shall always execute it to the best of my ability; if therefore the administrator has complained in this regard, it must be the result of his angry pen. But moreover YOUR SERENE AND ILLUSTRIOUS HIGHNESS must yourself remember, in your graciousness, that I cannot serve two masters, and cannot accept the commands of, and subordinate myself to, the administrator, for YOUR SERENE AND ILLUSTRIOUS HIGHNESS once said to me: COME FIRST TO ME, BECAUSE I AM HIS MASTER. I am therefore confident that YOUR SERENE AND ILLUSTRIOUS HIGHNESS will not receive ungraciously this my most submissive and obedient letter, but will regard me and the whole band with gracious eyes, and, since everyone is desirous of this grace, that you will watch over us in fatherly protection. I hope for further marks of favor and grace from YOUR HIGHNESS and I remain ever, with every mark of profound respect, YOUR SERENE AND GRACIOUS HIGHNESS’ most humble and obedient Josephus Haydn. Eisenstadt, 9th September 1765.",
jhdoc0003,,record,"Rahier to Nikolaus I, Prince Esterházy, Eisenstadt, 13 September 1765",1765-09-13,"Joseph Haydn;Nikolaus I, Prince Esterházy;Franz Siegl;Peter Ludwig von Rahier;Carl Friberth;imprisonment;punishment",Eisenstadt,47.840734,16.524253,Bartha GBA no. 4; Landon CCLN pp. 4-5,ger,"autograph, Esterházy Archives Acta Musicalia","Durchlauchtigst Hochgebohrner Reichs-Fürst etc. Gnädigster Herr Herr etc. etc. Gestern ist endlich der Kapelmeister Hayden und der Friberth bey mir geweßen; der letztere hat sich wegen der jüngsthin ausgestossenen ungebührlichen Reden und darauf andictirten Arrest submittiret, Depreciret und gebetten, daß es ihme verzeihen möchte: Ich habe ihme zur Antwort gegeben, ich hätte es bereits Ewer Durchl. Gemeldet, und von dannen muste anjetzo das weitere erwartet werden, weillen Er sich aber submittirt und deprecirt hätte, so würde ich Ewer Durchl. Selbst unterthänigst bitten, es vor diesmahl bey der geschehenen Submittir: und Deprecirung gnädigst bewenden zu lassen; Um dessen Bestättigung dan nauch unterthänigst bitten thue. Heute Nachmittag habe in Gegenwart der ganzten Music den Siegl anbefohlener massen seines Arrest und zugleich seiner diensten entlassen, und anbefohlen, daß der Kapelmeister alles, was an Kleydung, instrumenten und Musicalien Ewer Durchl. Gehörig seyn möchte, übernehmen, und sodann der OberEinnehmer Zoller ihn bis heute inclusive auszahlen solle. Die zwey Waldhornisten hätten heute noch, wie mir der Hayden meldet, nacher Süttör abgehen sollen, allein weillen Einer eben heute früh Unpäßlichkeit halber Medicin eingenohmen und dahero nicht reyßen können, so werden Sie morgen früh mit sambt dem Tag aufbrechen, um zu Mittag aldorten eintreffen zu können; womit in tiefesten respect verharre, Ewer Durchlaucht etc. etc. Unterthänigst gehorsamster diener Ragier mppria. Eisenstadt den 13tn 7bris [Sept.] 1765.","Most gracious Prince! Yesterday Kapellmeister Haydn und Friberth came to see me; the latter humbly apologized for his unsuitable conversation recently and asked that it be forgiven him. I answered him that I had already informed Your Highness and that you would take any further action. But since he apologized so humbly, I respectfully suggest to Your Highness that this time you graciously leave it at the humble apology…Siegl has served his detention and has been set at liberty…Rahier m.pr. 1765, 13th September.",
jhdoc0004,,record,"Regulatio Chori Kissmartionensis, Nikolaus I, Prince Esterházy to Joseph Haydn, Süttör, October-November 1765",1765-11-01,"Joseph Haydn;Nikolaus I, Prince Esterházy;Joseph Diezl;catalog;baryton;concerts;academies",Süttör,47.617929,16.876897,Bartha GBA no. 5; Landon CCLN pp. 5-6,ger,"autograph, Esterházy Archives Acta Musicalia I, 346","[“Regulatio Chori KissMartionensis”] Nachdeme auf dem Chor der Eisenstädter Schloß-Kapellen unter denen Musicis, Saumseeligkeit undt übler Einverständniß wegen, bey denen Chor-Instrumenten aber wegen Schlechter Obsicht und Verwahrung derenselben eine sehr grosse Unordnung verspühret worden; So wird dem Kapellmeister Hayden hiermit ernstlich angefohlen Erstlich ein dreyfaches gleichlautendes Inventarium über alle befindliche Chor-Instrumenten und Musicalien nach beyliegenden formulare mit Benennung deren Authorn, Stimmen etc. vom heutigen dato an innerhalb acht Tägen zu verfassen, zu unterschreiben, und von dießen eines Uns, das andere in die Buchhalterey, und das dritte auf dem Chor abzugeben: Andertens dem Schulmeister Joseph Diezl bey jeden Chor-Dienst die nöthige Musicalien hervorzugeben, dieße durch denselben austheilen, auch durch ihme nach den Dienst wieder zusamm klauben und sich übergeben zu lassen, damit solche in dem darzu bestimt Kasten wieder richtig aufgehoben, verschlossen, und keine verschlept oder verlohren werden können: Drittens auf den Schulmeister ach tzu haben, daß Er alle Chor-Instrumenten allezeit in guten brauchbahren Standt und Ordnung erhalte, zu welchem Ende Er Schulmeister allemahl ein viertl Stund vor jedem Dienst auf dem Chor zu ercheinen befehliget ist: Viertens besondere Sorge darauf zu tragen, daß alle Chor-Leuthe bey jedem Kirchen dienste ihrer Pflicht und Schuldigkeit nach erscheinen, und ihre Chor dienste mit guter Einverständniß wohl und Pflichtmässig verrichten: Fünftens in Unßerer Abweßenheit in dem Eisenstädter Officier Zimmer wochentlich zwey Musicalische Accademien alß am dienstag und donnerstag von zwey bis vier Uhr Nachmittags von gesamten Musicis zu halten, und damit 6. sich keiner in hinkunft, wie bishero geschehen, unterfangen möge, von den Chor- und Kirchen diensten, oder von erstgedachten Accademien sich zu absentiren, ohne darummen der Billigkeit nach abgesehen zu werden, Uns alle vierzehen Täge einen Schriftlichen Rapport derjenigen mit Nahmen und Beyruckung [?] der Ursach einzuschicken, welche von dießem oder jenen Dienst auszubleiben, sich werden angemasset haben. [“Sechsten” gestrichen] Endlichen wird ihem Capelmeister Haydn bestermassen anbefohlen[,] sich selbsten embsiger alß bißhero auf die Compositionen zu legen, und besonders solche stücken, die man auf der Gamba spiellen mag, und wouon wir noch sehr wenig gesehen haben, zu Componieren um seinen Fleiß sehen zu könen, von allen waß immer einen Compositionen das erste stuckh sauber, und rein abschreibener unß jeder zeit einschicken. Formulare Inventarium Süttör den 1765.","Regulatio Chori Kissmartionensis Inasmuch as the musicians of the Eisenstadt Chapel Choir have produced a great disorder in the choir-loft, because of indolence and lack of discipline, and have neglected the instruments through poor care and storage, Capellmeister Hayden [sic] is herewith earnestly enjoined as follows: First, to prepare a catalogue, in three identical copies, of all the extant instruments in the choir-loft, as well as of the music, according to the enclosed formula, with indication of the composers, number of parts, etc., and will deliver the same within eight days: one to us, the second to the bookkeeper’s office, and the third to the choir-loft. Secondly, to deliver the necessary music for each service to the schoolmaster Joseph Diezl, put it in their proper order after the service, and have it returned to, and stored in, the cupboards where it belongs, so that nothing will be taken away or miscatalogued. Third, to see to it that the schoolmaster keeps all the instruments constantly in good repair and in proper order, to which end said schoolmaster should always appear in the choir-loft a quarter of an hour before the service begins. Fourthly, to take especial pains to ensure that all the players appear regularly at the church services and fulfill their duty and obligations in a proper and disciplined way. Fifthly, to hold in our absence two musical concerts [Academien] every week in the Officers’ room at Eisenstadt, viz., on Tuesdays and Saturdays from 2 to 4 o’clock in the afternoon. All the musicians shall appear and to assure that in future no one is absent without permission from the church services or concerts (as was the case hitherto), a written report will be delivered to us every fortnight, with the name of, and reason for, anyone presuming to absent themselves from duty. Finally, said Capel Meister Haydn is urgently enjoined to apply himself to composition more diligently than heretofore, and especially to write such pieces as can be played on the gamba, of which pieces we have seen very few up to now; and to be able to judge his diligence, he shall at all times send us the first copy, cleanly and carefully written, of each and every new composition. Nicolaus, Prince Esterhazy. Süttör, the [blank = October or Novemeber] 1765.",
jhdoc0005,,record,"Haydn to Nikolaus I, Prince Esterházy, 5 December 1766",1766-12-05,"Joseph Haydn;Nikolaus I, Prince Esterházy;Name Day;divertimenti;baryton;clothing;provisions;gifts;baryton trios;binding;copying;revisions;oboists;oboes;instrument repair;instrument purchase;Mathias Rockobauer;uniforms",,,,Bartha GBA no. 6; Landon CCLN pp. 6-7,ger,"Autograph, Esterházy Archives Acta Musicalia I, 53","DURCHLAUCHTIG HOCHGEBOHRNER / REICHS FÜRST! GNÄDIGST: UND HÖCHST GEBIETHENDER HERR / HERR! Das höchst erfreuliche Nahmens Fest (welche EUER DURCHL: mit der Göttlichen Gnade in vollkommensten wohlstand und vergnügen vollbringen mögen) hat mich schuldigst verpflichtet, HOCHDEROSELBEN nicht nur allein 6 Neue Divertimenti in aller Submission zu übermachen, sonder nauch (weillen wür vor einigen Tagen mit denen Neuen Winter Kleydern höchstens consoliret worden) vor diese bosondere Gnad EUER DURCHL. Unterthänigst den Rochh zu küssen, mit den Beysatz, daß wür obschon in HOCH DERO von uns billich bedaurender abwesenheit, uns dannoch unterfangen werden, an EUER DURCHLAUCHT hohen Nahmens Tag bey Celebrirenden Solennen Amt in diesen Neuen Kleydern das erstemahl zu erscheinen. Anbey habe zwar den hohen Befehl erhalten, das ich die durch mich Componirte Divertimenti (zwölf Stuckh zusammen) solte einbinden lassen. allein weillen EUER DURCHL: einige derenselben zur Veränderungen nicht annotiret habe, als bitte ich unterthänigst, die bey handen habende erstere 12 Stuckh nur auf 3 täg, sodan auch die übrige nach und nach mir zukommen zu lassen, damit nebst denen beschehenen Veränderungen alles gut und genau abgeschrieben, und eingebunden werden könne: worbey mich zu Gleich gehorsambst anfragen wollen, auf was arth selbe einbinden zu lassen? EUER DURCHL: beliebig seye? Übrigens melden mir die zwey hautboisten (gliechwie ich auch selbsten eingestehen mus) das ihre 2 hautboi alters halber zu grund gehen, und den rechtmässigen Tonum nicht mehr geben, wesswegen EUER DURCHL: den schuldigsten Vortrag mache, das ein Meister Rockobauer in Wienn sich befinde, welcher meines erachtens dissfahls der kündigste ist. weillen nun dieser Meister mit derley arbeith zwar stätts beschäffigst ist, dermahlen aber sich besondere zeit nehmete, ein Paar gute daurhaffte hautboi mit einen extra stuckh auf satz (womit alle erforderliche Toni genohmen werden könten) zu verfertigen, dauor aber der nächste Preyß in 8 Ducaten bestehet. als habe EUER DURCHL. hohen Consens zu erwarthen, ob besagte 2 höchst nöthige hautboi um erstgemelten Preyß eingeschaffet werden dürfften. Der ich mich zu holen hulden und gnaden empfehle EUER HOCHFÜRSTLICHEN DURCHLAUCHT Unterthänigster Joseph Haydn. [Undatiert, aber außen Kanzleivermerk:] den 5t Xbris [Dez.] 1766.","MOST SERENE HIGHNESS AND NOBLE PRINCE OF THE HOLY ROMAN EMPIRE GRACIOUS AND DREAD LORD! The most joyous occasion of your name day (may YOUR HIGHNESS celebrate it in divine Grace and enjoy it in complete well-being and felicity!) obliges me not only to deliver to you in profound submission 6 new Divertimenti, but also to say that we were delighted to receive, a few days ago, our new Winter clothes—and submissively to kiss the hem of your robes for this especial act of grace: adding that, despite YOUR HIGHNESS’ much regretted absence, we shall nevertheless venture to wear these new clothes for the first time during the celebration of High Mass on YOUR HIGHNESS’ name day. I have received YOUR HIGHNESS’ order to have the Divertimenti I wrote (twelve pieces in all) bound. But since YOUR HIGHNESS has returned some of them to me to be altered, and I have not noted the changes in the my score, I would respectfully ask you to let me have the first twelve you have at hand for three days, and then the others one after the other, so that apart from the required changes, they may all be neatly and correctly copied and bound: in this connection I would like to ask respectfully which way YOUR HIGHNESS would like to have them bound. Incidentally, two oboe players report (and I myself must agree with them) that their oboes are so old that they are collapsing, and no longer keep the proper pitch [Tonum]; for this reason I would humbly point out to YOUR HIGHNESS that there is a master Rockobauer in Vienna, who in my opinion is the most skillful for this sort of work. But because this master is continually busy with work of this kind, and since it requires an exceptionally long time to complete a pair of good and durable oboes with an extra length of reed pipe (as a result of which, however, all the necessary notes can be produced)—for these reasons the cheapest price is 8 ducats. I therefore await YOUR HIGHNESS’ gracious consent whether the above-mentioned and most urgently needed two oboes may be constructed for the price indicated. I hope for your favour and grace, YOUR SERENE AND GRACIOUS HIGHNESS’ most humble Joseph Haydn. [5th December 1766].",
