objectid,filename,format,title,date,subject,location,latitude,longitude,source,language,landonsource,barthatext,landontext,
jhdoc0010,,record,"Haydn's personal billing of travel expenses to Pressburg, Eisenstadt, 16 May 1769",1769-05-16,"Joseph Haydn;travel;singers;soprano singers;alto singers;Nikolaus I, Prince Esterházy;Pressburg;Eisenstadt;Eszterháza;personnel;money",Eisenstadt,47.840734,16.524253,"Bartha GBA no. 10; Landon HCW2, p. 158",ger,"Autograph, Esterházy Archives Acta Musicalia XIII, 740","Specification Was ich auf Befehl Seiner Hochfürstlichen Durchlaucht in der Reiß nach Presburg ausgeleget, um Neue Singerinnen aufzunehmen. Die Fuhr von Presburg auf 3 Täg wegen üblen wetter accordirt 7 Fl. Die Fuhr von Eisenstadt nach Estoras: 4 Fl. Die Kost vor 5 Täg: 5 Fl. 30 xr. Summa: 16 Fl. 30 xr. Eisenstadt, den 16ten May 1769 Josephus Haydn mppria. Habe diese 16 Fl. 30 xr. von den Herrn RentMeister Nigst richtig Empfangen.","Specification What I advanced for a trip to Presburg made at the order of His Serene Highness to engage new female singers. The trip from Presburg which took 3 days because of bad weather, arranged at: 7 Fl. The trip from Eisenstadt to Estoras: 4 Fl. Living expenses for 5 days: 5 Fl. 30 xr. Summa 16 Fl. 30 xr. Eisenstadt, 16th May 1769 Josephus Haydn mppria. I have correctly received these 16 Fl. 30 xr. From the Herrn RentMeister Nigst.","Specification What I advanced for a trip to Presburg made at the order of His Serene Highness to engage new female singers. The trip from Presburg which took 3 days because of bad weather, arranged at: 7 Fl. The trip from Eisenstadt to Estoras: 4 Fl. Living expenses for 5 days: 5 Fl. 30 xr. Summa 16 Fl. 30 xr. Eisenstadt, 16th May 1769 Josephus Haydn mppria. I have correctly received these 16 Fl. 30 xr. From the Herrn RentMeister Nigst."
jhdoc0011,,record,"Haydn to Nikolaus I, Prince Esterházy, Autumn 1770",1770-10-01,"Joseph Haydn;Nikolaus I, Prince Esterházy;money;lodging;Eisenstadt",Eisenstadt,47.840734,16.524253,Bartha GBA no. 11a; Landon CCLN p. 13,ger,"Autograph, Esterházy Archives Acta Musicalia I, 50","DURCHLAUCHTIG: HOCHGEBOHRNER REICHS FÜRST! GNÄDIGST: HOCHGEBIETHENDER HERR HERR! Da ich zu erkauffung meines Hauses 400 Fl. baares geld vor etlichen Jahren entlehnen muste, und dieses Capital mir jezo aufgekündet worden, Als habe in ermanglung dessen schon verschiedener Orthen zu abstossung dieser Schuld widerum so vieles gegen bezahlenden Interesse aufnehmen wollen, Weillen aber alhier in Eisenstadt keinen Creditorem ertragen könen, und ich dieses aufgekündete geld in kürzte erlgegen solte dahero EUER DURCHLAUCHT unterthänigst bitte mir diese 400 Fl. gegen deme aus der General Cassa gnädigst erfolgen zu lassen, daß mir die aus derselben quartaliter assignirte 50 Fl. (deren die erst emit Ende Januarij 1771 mir schon fallen) in so lang abgezohen werden, bis die ganzte Schuld ersetzet seyn wird. Der mich zu hohen hulden und gnaden unterthänigst befehle. EUER HOCHFÜRSTLICHEN DURCHLAUCHT Unterthänigster Josephus Haydn.","Serene Highness and Noble Prince of the Holy Roman Empire, Gracious and dread Lord! In order to purchase my house, I had to borrow 400 Gulden in cash some years ago, and now this capital has been recalled. Since I do not have the sum, I wanted to take out another loan in this amount (on which I would pay interest) to repay the debts. But I could not find any creditors here in Eisenstadt, and inasmuch as I have to repay this loan soon, I would humbly ask Your Highness graciously to allow me to have these 400 Gulden, against a receipt from the cashier’s office, whereby the 50 Gulden I receive quarterly from that source (of which the first payment is due to me by the end of January 1771) would be withheld until such time as the whole debt is repayed. I most humbly commend myself to your favour and grace, Your Serene Highness’ most humble Josephus Haydn.",
jhdoc0012,,record,"Contract between Zacharius Pohl and Xavier Marteau in Haydn’s Presence, 21 December 1771",1770-12-21,Joseph Haydn;contracts;Zacharius Pohl;Franz Xavier Marteau;oboists;cellists;fighting;Eisenstadt;Schloss Esterházy (Eisenstadt);orchestra personnel;money;taverns;injuries;mediation,Eisenstadt,47.840734,16.524253,Bartha GBA no. 12; Landon CCLN p. 14,ger,"Autograph, Esterházy Archives Acta Musicalia","Contractus inter Zachariam Pohl, et Xaverium Marteau Musicos, vi cujus hic ob laesum Musici Pohl oculum ad respondas [? restituendas?] in curam habitas expensas semet obligat. Heute zu Ende gesetzten Dato und Jahr ist zwischen dem fürstl. Eszterhazyschen Hauboisten ZACHARIAS POHL, und dem auch fürst. Eszterhazyschen Bassetlisten XAVIER MARTEAU wegen den – den 24tn des verflossenen Monaths Junij in dem Eszterházer Schloß-Wirthshauß mit einander gehabten Rauffhandel, wobey Zacharias Pohl seines rechten Augs beraubt worden ist, nachfolgender Vergleichs CONTRACT erichtet, und beschlossen worden; alß: Nachdeme aus denen Aussagen beeder theilen, und verschiedener Zeugen zu Muthmassen ist, daß der XAVIER MARTEAU dem ZACHARIAS POHL diesen Schaden am Aug mit dem Ring, nicht zwar vorsetzlich zugefügt habe, der ZACHARIAS POHL aber nicht gäntzlichen ausser Schuld seye, weillen Er zu diesen Handel auch Anlaß gegeben hat; so haben sich beyde in Gegenwart des H. Kapelmeister Hayden dahin verglichen, daß XAVIER MARTEAU dem ZACHARIAS POHL die wegen besagten Schaden gehabte Rur- und Reiß Unckosten mit VIERZTIG NEUN Gulden 43 Xr: und zwar innerhalb Sechs Monath emit Monathlichen ACHT Gulden 17 1/6 Xr; und zwar die erste 8 Fl 17 1/6 Xr. mit ersten JANUARY 1772 bezahlen werde, ZACHARIAS POHL aber über dieses wegen den am Aug überkommenen Schaden an ihme MARTEAU zu keiner zeit etwas forderen könne, oder wolle. Urckund dessen haben sich beyde eigenhändig unterschrieben, und ihr gewöhnliches Petschafft beygedruckt. Eisenstadt den 21tn Decembris 1771. L. S. Zacharias Pohl mp. Hochfürstlicher Hautboist L. S. Xavier Marteau Hochfürßlicher Bassetlist. In meiner Gegewarth. L. S. Josephus Haydn mppria Hoch fürstlicher Capell-Meister.","Contractus inter Zachariam Pohl, et Xaverium Marteau Musicos, vi cujus hic ob laesum Musici Pohl oculum ad respondas in curam habitas expensas semet obligat. This day on the date and year recorded below is herewith set down and agreed the following settlement and contract between the Princely Esterházy oboist, Zacharias Pohl, and the Princely Esterházy bass-player, Xavier Marteau, because of the scandalous brawl between them which occurred on the 23rd of the previous month of June in the Esterházy Castle Tavern, whereby Zacharias Pohl lost his right eye; to wit:– Whereas, according to the statements of both parties and various witnesses, it may be surmised that Xavier Marteau did not purposely intend to inflict this damage with his ring on the eye of Zacharias Pohl, but on the other hand, Zacharias Pohl is not entirely guiltless, both parties have therefore agreed, in the presence of Herr Kappelmeister Hayden [sic], to the following settlement: that Xavier Marteau shall recompense Zacharias Pohl for the costs of the cure and trip arising from the above-mentioned damage, in the amount of forty-nine Gulden 13 Kreutzer, within six months, at the rate of 8 Gulden 17 1/6 Kr. per month, of which the first 8 Fl. 17 1/6 Kr. are to be paid on the first of January 1772; but Zacharias Pohl, because of the indemnification here given him as a result of the damage to his eye, shall not and can not demand anything at any time from Xavier Marteau. As witness thereto both parties have set their hands and their customary seals. Eisenstadt, the 21st of December 1771. L.s. Zacharias Pohl, hochfürstlicher Hautboist. L.s. Xavier Marteau, hochfürstlicher Bassetist. In my presence: Josephus Haydn, Hochfürstlicher Capellmeister L.s.",
jhdoc0013,,record,"Haydn to Anton Scheffstoss, “Secretaire” and Chief Bookkeeper of the Esterházy Administration, Eisenstadt, 9 January 1772",1772-01-09,"Joseph Haydn;Anton Scheffstoss;illness;Franz Xavier Marteau;Nikolaus I, Prince Esterházy;money;lodging;provisions;Andreas Lidl;barytonists;cellists;Joseph Weigl;Anna Maria Josepha Weigl",Eisenstadt,47.840734,16.524253,Bartha GBA no. 13; Landon CCLN p. 15,ger,"Autograph, Esterházy Archives Acta Musicalia I, 51","Eisenstadt den 9ten Jenner 1772 Hoch Edl gebohrn und Sonders hochzu Ehrender Monsieur Scheffstoss; Sage verbundensten dancke vor all diese gute gesinnungen, so Sie in betraf meiner wünsche, und deren Erfolge durch Ihre Vorsprechungen an mir Erfülleten, ich würde diese dancksagung vermög meiner schuldigkeit schon längstens Erstattet haben, wan mich nicht ein und andere unbässlichkeiten dauon abgehalten: Liebster Monsieur Scheffstoß, helfen Sie auch den Marton [Marteau] durch Ihre güte dahin, damit Ihme Seine gebührende 6 Klaffter Brenholtz, 30 Loth Kertzen, und 30 Fl. Quartier geld, welche Seine Durchlaucht mit Ihme durch mich Accordirt) erfolget werden; und ist hierinfals der Fehler in Seinen Contract, daß Er das Deputat wie der lidl zu geniessen habe, indeme doch in des lidls Contract von denen 30 Loth Kertzen (welche S: Durchl: mit mir bey meiner Ehre Accordirt) nichts zu finden übrigens bitte meinen gehorsambsten Respect an Dero frau gemahlin und Weiglische Familie (Welcher ich mit nächsten schreiben werde) und an alle übrige gute freund. ich aber verbleibe mi taller hochachtung Euer Hoch Edlen dienstErgenbenster Dr [Diener] Josephus Haydn mppria.","Eisenstadt, 9th January 1772. Nobly born and highly respected Monsieur Scheffstoss, You have my grateful thanks for all your kind efforts on behalf of my wishes, the fulfillment of which is the result of your intercessions for me. I would have thanked you long ago and acknowledged my indebtedness, if I were not, and had not been, prevented by illness. Dearest Monsieur Scheffstoss, please also help Marteau through your kindness to get the 6 cords of wood, 30 lbs. of candles, and 30 Gulden lodging money which should be his, and which His Highness promised me to give him; the mistake in this case lies in his contract, according to which he is to receive the same allowance as Lidl, although even in Lidl’s contract there is no mention of the 30 lbs. of candles (which, I assure you on my honour, His Highness agreed to grant him). Apart from this please present my respectful compliments to your wife and the Weigl family (to whom I shall write shortly), and to all other good friends. And I remain, with all respect, noble Sir, Your obedient servant, Joseph Haydn.",
jhdoc0014,,record,"Haydn to Nikolaus I, Prince Esterházy, March 1773",1773-03-01,"Joseph Haydn;Nikolaus I, Prince Esterházy;Anton Scheffstoss;salaries;wills and testaments;Paul II Anton, Prince Esterházy",,,,"Bartha GBA no. 14; Landon CCLN, pp. 15-16",ger,"Autograph, Esterházy Archives Acta Musicalia XII, 625","Durchlauchtig-Hochgebohrner Reichs-Fürst! Gnädigst Hochgebiethender Herr, Herr! Da Euer Durchlaucht durch Hochdero Secretarium Scheffstoß mir bedeuten laßen, daß Hochdieselbe gnädigst gesonnen wären mir so wohl, als der übrigen — bey hintritt Sr Hochfl. Durchl: Herrn Bruders in diensten gestasndenen Kammer Music eine Jahrs Besoldung (wann jeder derenselben Euer Durchl: dieserwegen supplicando belangen würde) freygebigst zu ertheillen. derowegen Euer Durchl: demüthigst bitte, höchstdero Gesinnung und ausnehmende Gnade mit einer gütigsten Anweisung zu bestätigen. Wofür meine eyfrigste Dienste jederzeit leysten werde, und mich zu Höchsten Hulden und Gnaden empfehle Euer Hochfürstlichen Durchlaucht unterthänigster Joseph Hayden Capell: Meister","Most Serene and Noble Prince of the Holy Roman Empire, Gracious and dread Lord! Your Highness intimated to me, through His Highness’ secretary Schefstoss [sic] that you would be minded graciously and generously to provide a year’s salary to me and to those chamber musicians who entered the service of Your Serene Highness’ brother (provided that each of us would submit a petition to that effect to Your Highness). May I therefore ask, in profound submissiveness, that Your Highness confirm, in your infinite kindness, your willingness to grant us this exceptionally gracious mark of esteem. For this, I shall offer you at all times my most faithful services, and I recommend myself to your serene favour and grace. Your Serene Highness’ most humble Joseph Hayden [sic] Capell-Meister [Address:] To His Serene and Noble Highness, Prince of the Holy Roman Empire, Lord and Sire, Nicolaum Esterházy von Galantha, Knight of the Golden Fleece, Privy Councillor in actual service of His Imperial and Royal Majesty, General Field Marshal of the Imperial and Royal Aristocratic Guards, Captain &c. &c. My gracious Prince and Sire: this humble request is submitted ut intus by CapellMeister Haydn.",
jhdoc0015,,record,"Nikolaus I, Prince Esterházy’s note granting Haydn’s salary request, Vienna, 1 April 1773",1773-04-01,"Nikolaus I, Prince Esterházy;Joseph Haydn;salaries;taxes;Paul II Anton, Prince Esterházy;wills and testaments;Christoph Sonnleithner",Vienna,48.207303,16.374138,"Bartha GBA no. 14; Landon CCLN, pp. 16",ger,"Autograph, Esterházy Archives Acta Musicalia XII, 625","Wann keine gegenforderung ist, solle dem Instanzen die Jahrs Besoldung, welche er damals contractmässig hatte, gegen Abzug der Erbschaftssteuer per 10 prozento bezahlet, und in unserer General Cassa beausgaabet, der Betrag der Erbsteuer aber gegen erforderlicher Quittung Hrn Doctor Sonleithner übergegen werden. Wienn den 1ten April 1773. Nicolaus Fürst Esterházy.","If there is no counter-claim, the suppliant should be paid one year’s salary according to the contract then in force, minus ten percent inheritance tax; this sum is to be paid out by our Chief Cashier’s Office, but the sum of the inheritance tax is to be delivered to Doctor Sonleithner after securing the necessary receipt. Vienna, 1st April 1773. Nicolaus Fürst Esterházy m.p.",
jhdoc0016,,record,"Haydn’s receipt to the Esterházy Cashier for salary moneys received per his request to the Prince, Eisenstadt, 29 April 1773",1773-04-29,"Joseph Haydn;money;salaries;wills and testaments;taxes;Nikolaus I, Prince Esterházy;Paul II Anton, Prince Esterházy;Schloss Esterházy (Eisenstadt);Eisenstadt",Eisenstadt,47.840734,16.524253,"Bartha GBA no. 15; Landon CCLN, pp. 16-17",ger,"Autograph, Esterházy Archives Acta Musicalia XII, 626","Ich endes Unterschriebener Beckene hiemit, daß Ich vermög der von Sr Hochfürstlichen Durchlaucht heraus gegebenen Decretation die Jenige von Sr Durchlaucht weyland Fürst Antonj Estorhazy Hoch Seeligen angedenckens Lauth Testaments qua Hauß Officier Legirte Jahrs Besoldung per 400 Fl. Sage Vier Hundert Gulden Aus der Hochfürstlichen General Cassa und Handen des Ober-Einnehmers Herrn Züsser Baar und Richtig solcher gestalten Empfangen habe, daß weithers an Hochfürstlichen Hause nicht die mindeste Anforderung mehr machen köne. Schloß Eisenstadt den 29ten Aprill / 1773 Josephus Haydn mppria. Capell Meister","I, the undersigned, herewith acknowledge to have received correctly and in cash from Herr Züsser, receiver-general of the Princely Cashier’s Office, the sum of 400 Fl. (in words: Gulden four hundred), which according to a decree issued by His Serene Highness has been bequeathed to me as qua staff officer under the provisions of the last will and testament of his late lamented Highness Prince Antony Esterházy; and I acknowledge further that I cannot make any other claim whatever on the Princely house. Eisenstadt Castle, the 29th of April 1773. Josephus Haydn [m.]pria Capell Meister",
jhdoc0017,,record,"Haydn's handwritten receipt for opera expenses, Eisenstadt, 30 November 1773",1773-11-30,"Joseph Haydn;Nikolaus I, Prince Esterházy;operas;marionette operas;money;salaries;bass singers;alto singers;tenor singers;Eisenstadt;gifts;Joseph Züsser;Johann Baptist Krumpholtz;Michael Haydn;harpists;Elisabeth Griessler;Ödenburg",Eisenstadt,47.840734,16.524253,"Bartha GBA no. 16; Landon HCW2, p. 201",ger,"Autograph, Esterházy Archives Acta Musicalia XI, 601a","Was ich vor Se Hochfürstliche Durchlaucht ausgegeben 1. als dem Bassisten von Oedenburg zur Marionetten Opera für 5 Tag des Tags 3 Fl. Accordirt macht 15 fl. 2. Der Altistin Griesslerin v. Eysenstadt vor 8 Tag des Tags einen Gulden macht 8 fl. 3. Item den Tenoristen Johann Haydn vor 8 Tag 8 Fl. 4. Dem Friseur vor beede Opera 7 fl. 40 xr. 5. Dem Harpfenisten Krumpholtz Discretion 4 Cremnitzer Ducaten macht 17 fl. 12 xr. Summa: 55 Rfl. 52 xr. Obige 55 fl. 52 xr. Seynd mir aus der Eisenstädter General Cassa, und Handen des Herrn Ober Einnehmer Joseph Züsser richtig und baar bezahlet worden. Eisenstadt den 30ten 9bris [Nov.] 1773 Josephus Haydn mppria.","What I spent for H. Princely Highness, viz.: 1. The bass singer from Oedenburg for the marionette opera, for five days, each day 3 Fl. as agreed, makes 15 Fl. r. 2. The alto singer Griessler from Eisenstadt for 8 days, each day one Gulden, makes 8 Fl. 3. Item for the tenor Johann Haydn for 8 days 8 Fl. 4. The Hairdresser for both operas 7 Fl. 40 xr. 5. The harp players Krumpholtz Discretion [gift] 4 Cremnitz ducats makes 17 Fl. 12 xr. Summa: 55 Rfl. 52 xr. The above 55 Rfl. 52 xr. have been paid to me correctly and in cash from the Eisenstadt General Cassa by the hand of Chief Cashier Joseph Züsser. Eisenstadt, 30th Nov. 1773. Josephus Haydn mpria.",
jhdoc0018,,record,"Ordinance of Nikolaus I, Prince Esterházy to Regent Rahier, Vienna, 16 March 1774",1774-03-16,"Nikolaus I, Prince Esterházy;Peter Ludwig von Rahier;Joseph Haydn;orchestra personnel;travel;Christian Specht;bass singers;violists;Franz Xavier Marteau;cellists;Carl Chorus;oboists;salaries;Vienna;punishment;Joseph Oliva;hornists",Vienna,48.207303,16.374138,"Bartha GBA no. 17; Landon HCW2, p. 203",ger,"Autograph, Esterházy Archives Acta Musicalia XX, 1372","Wohl Edl Geboren Hochgeehrter Herr v. Rahier! Die Specification deren Musicis habe Rechtens erhalten, aus welcher ersehen, das der Christian Speck, Xaveri Marteau, Carl Corus, und Joseph Oliva abwesend seynd. Mithin müssen Sie weder gegen den Capel meister Heyden noch gegen die übrigen etwas mercken lassen, sondern nur ganz gleichgültig in der Sache bleiben. Übrigens aber Sorg tragen zu wissen wie lang ein Jeder deren Vier obbenanten Musicis abwesend bleiben wird, demnach die Täge zusammen zehln, auf ihrer besoldung ausrechnen, und von dem Ober Einnehmer ein Jeden von seinen Monath geld oder quartal wie Sie es zu Empfangen haben, abziehen lassen! Zur sicherheit aber mus gleich der Verboth in mein Nahmen gemacht werden, damit selbe vielleicht nicht zum voraus von ihrem gehalt heraus nehmen. Verbleibend Euer Wohl Edl gobohrn Bereitwilliger Nicolaus Fürst Esterhazy Wien, den 16tn Merzen 1774.","I have received promptly the specification of the musicians, from which I see that Christien Spech[t], Xavier Marteau, Carl Corus and Joseph Oliva are absent. You must see that neither Capel Meister Heyden [sic] nor any of the others notice anything, and you must act as if nothing had happened. However, you must find out how long each of those four above-mentioned musicians has been absent and add up the days, work that out against their salaries, and tell the Chief Cashier to subtract the necessary amount from their monthly or quarterly salaries. To make sure, however, this edict must be published in my name right away, so that they do not take an advance on their salaries… Vienna, 16th March 1774.",
jhdoc0019,,record,"Haydn to Nikolaus I, Prince Esterházy, c. 18 March 1774",1774-03-18,"Joseph Haydn;Nikolaus I, Prince Esterházy;salaries;punishment;mediation;Franz Xavier Marteau;Christian Specht;Carl Chorus;oboists;violists;bass singers;cellists;Vienna;copying;concertos;instrument repair;Dr. Bertrand;illness;medical treatment;Neustat;church services",,,,"Bartha GBA no. 18; Landon CCLN, pp. 17-18",ger,Esterházy Archives Acta Musicalia,"Durchlauchtigst Hochgeborener Herr Reichsfürst Gnädiger Fürst und Herr Herr! Nachdem Eure Hochfürstliche Durchlaucht denen Musicis als Marteau, Specht und Chorus vor einen Monath geld abziehen befohlen, unterfange mich Euere Hochfürstliche Durchlaucht gnädigst zu erinnern, wie ich er selbst letzthin in Wienn Euer Durchlaucht vor den Marteau auf einige Tage um die Erlaubniß gebetten, auch selbe von Ihro Durchlaucht gütigst erhalten, daß er aber etwas länger verblieben, war die ursach, diesweilen er sich allda einige neue Concerte abschreiben, ingleichen sein Violoncello zu richten lassen mußte. Den Chorus betreffend war die Zeut zu kurtz, es Euer Durchlaucht vorher zu wissen zu machen, indem er vor ohngefähr mit den Doctor Bertrand (welcher ihm wegen wegen [sic] seiner ständigen unbässlichkeit befohlen die luft zu verändern) umsonst und ohne Bezahlung hianauf [?] fahren könnte, unterstünde mich danenhero die Erlaubnis zu geben. Den Specht anbelangt, Ereignete es sich, daß seine Schwiegermutter in Neustat plötzlich erkrankt, Erlaubte ich ihm just zur Zeit, da er keinen Kirchendienst versäumte, auf drei tag dahin zu gehen. Gelanget danenhero an Euere Hochfürstliche Durchlaucht meine untertänigst gehorsamte Bitte denenselben diese Geldstrafe gnädigst nach zu setzen [sehen?], von welcher so hohen Gnade in der tiefsten untertänigkeit ersterbe Euere Hochfürstlichen Durchlaucht untertänigst gehorsamster Haydn","Most Serene and Noble Prince of the Holy Roman Empire, Gracious Prince and Lord! Inasmuch as Your Serene Highness has ordered a month’s salary to be docked from the musicians Marteau, Specht, and Chorus, I humbly beg to remind Your Serene Highness graciously to remember how in Vienna recently, I myself asked and kindly received permission of Your Highness for Marteau to absent himself for a few days. The reason why he remained a little longer is that he copied some new concerti there, and also had to have his violoncello repaired. Concerning Chorus, there was not enough time to inform Your Highness in advance of the face that he had the chance to go there [to Vienna] with Dr. Bertrand (who prescribed a change of air for him on account of his constant ill health) for nothing, at no cost; and it fell to me to give him permission to go. As far as Specht goes, it so happened that his mother-in-law suddenly fell ill in Neustat. I allowed him to go there just during the three days when he would not miss any of the church services. For this reason I submit my humble and obedient petition to Your Serene Highness, to refrain from insisting on this financial punishment; we ask for such a mark of graciousness in the most profound submissiveness. Your Serene Highness’ humble and obedient servant, Haydn.",
jhdoc0020,,record,"Report from Regent Rahier to Nikolaus I, Prince Esterházy about dismissal of musicians, Eisenstadt, 9 September 1775",1775-09-09,"Peter Ludwig von Rahier;Nikolaus I, Prince Esterházy;Michael Haydn;Franz Xavier Marteau;tenor singers;cellists;orchestra personnel;salaries;termination;money;Carl Friberth;tenor singers;Carl Schiringer;bassoonists;Johann Michael Spangler;debts;uniforms;Eszterháza",Eisenstadt,47.840734,16.524253,"Bartha GBA no. 19; Landon HCW2, p. 224",ger,"Autograph, Esterházy Archives Acta Musicalia III, 194","Durchlauchtigst Hochgeborener Reichs Fürst! Gnädigster Herr Herr etc. etc. Ich habe vermög hohen befehl dem Brudern des Hayden gleich gestern, und heute dem Bassetlist Marteau die Entlassung ihrem dienste angedeutet, dem Ober Einnehmer aber die Verordnung gegeben, Niemandten von der Musique, auch unter waß immer für einen Vorwandt, ein Geldt, ausser Euer Durchl. Anordnung, erfolgen zu lassen; dem Fribert, und Schiringer jedem 1 Fl. von der Monath Gage abzuziehen, und das Capital des Vatters der Fribertin gleich aufzukündigen. Der Marteau hat dem hießigen Schloß Pfleger den Rock, und die Weste von der Sommer Uniform zur Verwahrung übergeben, und wird mit der est überkommenen Gelegenheit sich nacher Eszterhaz begeden, alwo Er seine, und die übrige Uniforms Sachen hat; Euer Durchl. Geruhen demnach dem Kapellmeister zu befehlen, daß Er sich von ihme dorten die übrige noch abgängige Stückhe übergeben lasse. Womit in tieffesten respect verharre. Euer Durchlaucht Unterthänigst gehors[ams]ter diener Eisenstadt den 9ten 7bris [Sept.] 1775. Rahier mppria.","I have received your high order and forthwith yesterday informed Haydn’s brother, and today the Bassetlist [‘cellist] Marteau, that their respective services are terminated, and I have given the order to the Chief Cashier that no one of the musicians, no matter on what excuse, is to receive any money except on Your Highness’s order; I have subtracted 1 fl. from the monthly salary of Friebert [sic] and Schiringer, and called in the capital from Frau Fribert’s father. Marteau gave to the Castle Inspector here the coat and the waistcoat from his summer uniform, and will betake himself to Eszterhaz at the first available, where he has his things and the rest of his uniform. Your Highness could design to order the Kapelmeister [sic] to receive these other things from him [Marteau] there…Eisenstadt, 9th Sept. 1775.",
