objectid,filename,format,title,date,subject,location,latitude,longitude,source,language,landonsource,barthatext,landontext,
jhdoc0006,,record,"Haydn to Anton Scheffstoss, “Secretaire” and Chief Bookkeeper of the Esterházy Administration, Eisenstadt, 20 March 1768",1768-03-20,"Joseph Haydn;Anton Scheffstoss;Stabat Mater, Hob. XXa:1;Johann Adolf Hasse;lack of singers;travel;Vienna;Joseph Weigl;Anna Maria Josepha Weigl;Carl Friberth;Order of the Brothers of Mercy;Nikolaus I, Prince Esterházy;divertimenti;baryton trios;cellists;soprano singers;tenor singers",Eisenstadt,47.840734,16.524253,Bartha GBA no. 7; Landon CCLN p. 8,ger,"Autograph, Esterházy Archives Acta Musicalia I, 56r","Wohl Edl gebohrn Insonders Hochgeehrtister Herr! Es wird Ihnen onehin [?] beckant seyn, daß ich voriges Jahr den so hochschätzbaren Hymnum, Stabat Mater genant, in die Music nach allen meinen Kräften übersetzet, und Selben den grossen und weldberühmten Hasse aus keinen anderen absichten eingehändiget, als daß, in fall ich etwan die worth eines so grossen wehrts nicht genugsam solte ausgeübet haben, dieser mangel von einen in allen stücken so glücklichen Meister hierinfahls verbesseret werde: da mich aber wider meiner Verdienste dieser aus erlesene Ton: künstler mit unaussprechlichen lob über dieses wreck beehrte, und sich nichts anderes al smit einer dazu gehörig wohl besetzen Music zu hören wünschete, dermahlen aber ein grosser mangel in Wienn an denen Sängern utriusque generis, gelanget danenhero durch Euer Wohl Edl meine unterthägist gehorsambste bitt Se Hochfürstl: Durchlaucht, Mich, den Weigl, und dessen Frau, und den Friberth künfftigen donerstag nach Wienn zu erlauben, um alda freytag nachmittag bey denenen [sic] FFr:Miseric: die Ehre unseres gnädigsten fürstens durch producirung seiner Diener zu beförderen, Samstag abends würden wir in Eisenstadt eintreffen: wan Se Durchlaucht befehlen, wolte alsobald stat den Friberth einen anderen hinabschücken: Liebster Mons: Scheffstoss bitte um beschleunigung meines ersuchens der ich mi taller veneration bleibe Euer Wohl Edlen Ergebenster diener Josephus Haydn mppria. P:S: Mein Compliment an alle Messieurs. die versprochene Divertimenten werde Sr Durchl: diese wochen gewis einhändigen.","Nobly born, Highly respected Sir! You will recall that last year I set to music with all my power the highly esteemed hymn, called Stabat Mater, and that I sent it to the great and world-celebrated Hasse with no other intention than that in case, here and there, I had not expressed adequately words of such great importance, this lack could be rectified by a master so successful in all forms of music. But contrary to my merits, this unique artist honoured the worked by inexpressible praise, and wished nothing more than to hear it performed with the good players it requires. Since, however, there is a great want of singers utriusque generis in Vienna, I would therefore humbly and obediently ask His Serene and Gracious Highness through you, Sir, to allow me, Weigl and his wife, and Friberth to go to Vienna next Thursday, there on Friday afternoon at the FFr.:Miseric: [Barmherzige Brüder] to further the honour of our gracious prince by the performance of his servant; we would return to Eisenstadt on Saturday evening. If His Highness so wishes, someone other than Friberth could easily be sent up. Dearest Mons. Scheffstoss, please expedite my request; I remain, with the most profound veneration, Your nobly born Sir’s most devoted Josephus Haydn, [m.] pria. P.S. My compliments to all the gentlemen. The promised Divertimenti will surely be delivered to His Highness one of these next weeks.",
jhdoc0007,,record,Haydn to Unnamed Austrian Monastery—Probably Zwettl in Lower Austria—Accompanying the Score of the Applausus Cantanta (1768),1768,"Joseph Haydn;Applausus Cantata, Hob. XXIVa:6;performance practice;rhetoric;reputation;Eisenstadt;arias;recitatives;accompanied recitatives;Latin;orchestral forces;orchestration;violas;violinists;text setting;copying;copyists;rehearsals;audiences",,,,Bartha GBA no. 8; Landon CCLN pp. 9-11,ger,"Autograph, Gesellschaft der Musikfreunde, Vienna","Weilen Ich bey diesen Applaus nicht selbst zu Gegen seyn kan, habe ein und andere Ercklärungen vor nöthig gefunden und zwar Erstens Bitte ich, daß das Tempo in allen Arien und Recitativen genau in obacht genohmen werde, und da der gantze Text aplaudirend, ist mir lieber, wan ein und anders Allegro etwas schärffer wie sonst gewähnlich Tractiret wird, besonders im allerersten Rittornello und in ein und anderen Recitativen; wie nicht minder in denen 2 Baß Arien. 2tens Ist vor der Sinfonie nicht anderes zu machen nothwendig, als Ein Allegro und das Andante, indem das Erste Rittornell stat den letzten Allegro dienet: Wenn mir der Tag der Production bewust wäre, würde vielleicht bis dahin eine neue Sinfonie überschücken. 3tens ist in deden Accompagnirenden Recitativen wohl zu observiren, daß das Accompagnement nicht eher herein trette, als bis der Sänger vollekommen den Text abgesungen, obwohlen sich das Contrarium in der Spartitur öffters zeiget, als z: E: am anfang bey den Repertirten Worth Metamorphosis, wo die stimmen auf -phosis ihren anschlag haben, mus ungeacht dessen die letzte Sylbe von den Recitirenden vollkomen gehöret werden, alsdan aber geschwind den einfall machen; dan es würde sehr lächerlich seyn, wan man den Sänger das worth von mund herab geigete, und von selben nichts anders als qua Metamo verstünde: dieses aber lasse ich den Cembalisten über, und nach Ihme müssen sich all andere richten: NB: unsere gelehrte in Eisenstadt deren zwar sehr wenig disputirten sehr über das worth Metamorposis, einer wolte die vorletzte Sylbe kurtz, der andere aber lang, ungeachtet aber in welscher sprach Metamorphŏsi gesagt wird, habe doch in latein jederzeit gehöret Metamorphōsis, solte ich geirret haben, wäre dieser Fehler leicht zu verbessern. 4tens selbe in ihren werth genau Betrachtet werden, dan es ist ein sehr grosser unterscheid zwischen piano und pianissimo, forte und fortiss: zwischen crescendo und forzando und dergleichen. Es ist auch zu mercken, daß wan in der Spart ein forte oder piano nicht bey allen stimmen ausgesetzt, diesen mangel der Copist bey abschreibung ersetzen soll. 5tens weil ich mich in verschiedenen Accademien öffters geärgeret über manchen geiger, welcher da die so genanten ligaturen al seine der schönsten Figuren in der Music so jämerlich geschändet, und die ligatirte Notte, so mit der vorhergehenden zusam gezogen seyn solte, mit wideraufhebung des Bogens kurtz abgestossen, Recomendier ich diese den Primier Violinisten: Es würde danenhero albern seyn, wen man (wie in 47ten Tact zu sehen) anstat, [musical excerpt] da die 2 erste Notten einen strich erfordern, auf solche unangenehme und fehlerhafte arth als z. E. [musical excerpt] alles gestossen, als ob keine ligature vorhanden, abspiellete. 6tens Bitte, daß Beständig ihrer zwey die Viola spiellen, dan die Mittlestim erfordert in manchen fallen mehr gehöret zu werden als die Oberstim, man wird auch in allen meinen Compositionen sehen, daß selbe selten mit den Bass anhergehet. 7tens Wen die Violinstimmen dopelt müssen geschrieben werden, solle der Copist trachten, daß nicht alle zu Gleicher zeit umwenden müssen, dan dieses nihmt bey einer schwach besetzten Music vielle Krafft hinweg: Er solle auch bey denen Da Capo zeichen ʃʃ sich in obacht nehmen, und derohalben eine Prim Violin stimm schreiben so, wie die Spartitur aufweiset, der anderen aber kan Selber zwey Tact so nach diesen zeichen ʃʃ folgen noch hinzusetzen, und alsdan das zeichen an sein gehöriges orth machen. 8tens Recomendire ich vor allen denen zwey knaben [Solosänger] eine gute aussprach, langsam in Recitativen, damit man jede Sylbe verstehen kan, ingleichen die arth des gesanges in Rectiren, z. E. [musical example] muß also gesungen werden [musical example] und nicht [musical example] sondern die vorlezte Notte g bleibet vollkomen aus, und auf solche arth in allen übrigen fallen: Ich verlasse mich dessen auf die geschicklichkeit des Herrn Tenoristen, so denen knaben hierinfals alle anweisung geben wird. 9tens Verhoffe ich wenigstens von den ganzten werckh 3 oder 4 Proben. 10tens In der Sopran Aria kan allenfahls der Fagot ausbleiben, jedoch wäre es mir lieber, wan selber zugegen wäre, zu mahlen der Bass durchaus obligat, und schätze jene Music mit denen 3 Bassen, als Violoncello, Fagot und Violon höher, als 6 Violon mit 3 Violoncello, weil sich gewisse Passagen hart distinguiren. letztens/Bitte jeden besonders von deren Herrn Musicis um meine und ihre eigene Ehre zu beförderen Ihren möglichstein Fleiß anzuwenden: Solte ich etwan mit meiner arbeith den geschmack derselben nicht errathen haben, ist mir hierinfals nicht übl zu nehmen, weil mir weder die Persohnen, noch der ort beckant sind, die verhellung dessen hat mir in wahrheit diese arbeith sauer gemackt; übrigens aber wünsche ich, daß dieser Applausus sowohl dem Herrn Poeten und denen wehrtesten Herrn Tonkünstlern als auch dem Hochlöblichen Auditorio gefallen möge, der ich mit gröster Veneration allerseitig geharre Dero gehorsambster diener Giuseppe Haydn. Maestro di Cape: die Sua Alt: Ser: Prencipe d’Estorhazy","Since I cannot be present myself at this Applaus, I have found it necessary to provide one or two explanations concerning its execution, viz.: First, I would ask you to observe strictly the tempi of all the arias and recitatives, and since the whole text applauds, I would rather have the allegros taken a bit more quickly than usual, especially in the very first ritornello and in one or two of the recitatives; but no less in ʃthe two bass arias. Secondly: for the overture all you need to play is an allegro and an andante, for the opening ritornello takes the place of the final allegro. If I knew the day of the performance, I might perhaps send you a new overture by that time. Thirdly: in the accompanied recitatives, you must observe that the accompaniment should not enter until the singer has quite finished the text, even though the score often shows the contrary. For instance, at the beginning where the word ‘”metamorphosis” is repeated, and the orchestra comes in at “-phosis,” you must nevertheless wait until the last syllable is finished and then enter quickly; for it would be ridiculous if you would fiddle away the word from the singer’s mouth, and understand only the words “quae metamo…” But I leave this to the harpsichord player, and all the others must follow him. N.B.: our scholars in Eisenstadt—and there are very few—disputed a great deal over the word “metamorphosis”; one wanted the penultimate syllable short, the other long; and despite the fact that in Italian one says “metamōrfosi,” I have always heard it pronounced “metamorphōsis” in Latin; should I have made a mistake, the error can be easily corrected. Fourthly: that the fortes and pianos are written correctly throughout, and should be observed exactly; for there is a very great difference between piano and pianissimo, forte and fortiss[imo], between crescendo and forzando, and so forth. It should be noted, too, when in the score the one of the other forte or piano is not marked throughout all the parts, that the copyist should rectify this when preparing the performance material. Fifthly: I have often been annoyed at certain violinists in various concerts, who absolutely ruined the so-called ties—which are among the most beautiful things in music—in that they bounced the bows off the tied note, which should have been joined to the preceding note. And so I would point out to the first violinst that it would be silly to play the following (as found in bar 47) [musical excerpt] – in which the first two notes are to be taken on one bow—in such a disagreeable and mistaken way as [musical excerpt] all staccato, and as if there were no ties present. Sixthly: I would ask you to use two players on the viola part throughout, for the inner parts sometimes need to be heard more than the upper parts, and you will find in all my compositions that the viola rarely doubles the bass. Seventhly: if you have to copy two sets of violin parts, the copyist should see that they do not turn their pages at the same time, because this takes away a great deal of strength from an orchestra with only a few musicians. The copyist should also see that the da capo signs ʃʃ are written in one of the violin parts in the score, but in the other he put the da capo a couple of bars after the sign ʃʃ, and then write the sign in its proper place. Eighthly: I suggest that the two boys [soloists] in particular have a clear pronunciation, singing slowly in recitatives so that one can understand every syllable; and likewise they should follow the method of singing the recitation whereby, for example [musical excerpt] must be sung [musical excerpt] and not [musical excerpt] The penultimate note “g” drops out entirely, and this applies to all similar cases. I rely on the skill of the tenor, who will explain such things to the boys. Ninthly: I hope for at least three or four rehearsals for the entire work. Tenthly: in the soprano aria the bassoon can be omitted if absolutely necessary, but I would rather have it present, at least when the bass is obbligato throughout. And I prefer a band with 3 bass instruments—‘cello, bassoon and double bass—to one with 6 double basses and 3 ‘celli, because certain passages stand out better that way. Finally I ask everyone, and especially the musicians, for the sake of my reputation as well as their own, to be as diligent as possible: if I have perhaps not guessed the taste of these gentlemen, I am not to be blamed for it, for I know neither the persons nor the place, and that fact that they were concealed from me really made my work very difficult. For the rest, I hope that this Applausus will please the poet, the worthy musicians, and the honourable reverend Auditorio, all of whom I greet with profound respect, and for whom I remain Your most obedient servant, Giuseppe Haydn. Maestro di Cap: di Sua Alt: Sere: Prencipe d’Estorhazy",
jhdoc0008,,record,"Haydn to Anton Scheffstoss, “Secretaire” and Chief Bookkeeper of the Esterházy Administration, Petition to Nikolaus I, Prince Esterházy, Eisenstadt, 22 December 1768",1768-12-22,"Joseph Haydn;Anton Scheffstoss;Frantz Nigst;violinists;Joseph Diezl;orchestra personnel;tenor singers;Nikolaus I, Prince Esterházy;uniforms;operas;Vienna;Eisenstadt;Eszterháza;orchestral forces;salaries;baryton trios;hornists;Karl Franz;Johann May",Eisenstadt,47.840734,16.524253,Bartha GBA no. 9; Landon CCLN pp. 11-12,ger,"Autograph, Esterházy Archives Acta Musicalia I, 47","Wohl Edl geborhn Insonders HochgeEhrister Herr Secretaire! Übersende Ihnen meine bittschrift an Se: Durchl: den Fürsten also lautend. Durchl: Hochgeb: et: Eure hochfürstliche Durchl: haben mire jüngsthin gnädigst zu Wissen gemacht, daß nicht nur der alhiesige Räntmeister Frantz Nigst als Violinist, sonder nauch der Joseph Diezl als Tenorist bey der Music überflissig [sic] befunden worden, sonder nauch mir anbefohlen, von den ersteren die 2 Uniform absufordern: diesen ersteren nemlich Frantz Nigst betreffend, mus Euer Durchl: ich unterthänigst beybringen, und in Wahrheit gestehen, daß in denen bishero producirten opern bey den Violin Secund mit selben als den einzigen, so den Secund zu dirigiren in stand ist, bestens versehen ware, folglich, wan dieser abgethann wäre, künfftighin wegen unterlauffenden Fehlern in Forchten stund, es seye dan, daß etwan Eure Durchlaucht gnädigst gesonnen wären, einen anderen festen Secund geiger aufzu nehmen, oder zu producirenden opern einen von Wienn kommen zu lassen, dan zu den Secund ist sodan niemand als der Waldhornist Frantz und Mäy, mit denen führwahr nicht versehen wäre. Wahr ist es zwar, daß, wan die ganzte Music künfftiges Jahr nacher Esterhaz kommet, er wegen dem Räntamt nicht beständig in Esterhaz seyn könte, jedoch wäre meine unterthänigste Meinung, denselben (wan der K: K: Hof, oder andere hoche herschaften anwesend wären) nacher Esterhaz kommen zu lassen. Euer Durchl: demnach unterthänigst bitte, ihme noch ferners die Jährliche 50 Fl. Dan die Winter und Sommer Kleider (mit welche-letzteren er in Esterhaz scon dienste geleistet hat) gnädigst zu ertheillen. Der Joseph Dietzl ist meines erachtens auf den Chor besonders dazu mahlen nöthig, wan die gantze Music nach Esterhaz abgehet, damit der gewöhnliche Gottes dienst durch ihn, seinen preceptor, und seine in der lehr befindliche Singer buben bestritten würde. ich höre von mehreren, daß er mit dem schullmeister dienst allein ohnmöglich sich ernähren kan. bittete also eben unterthänigst ihme doch so vieles gnädigst aus zu werffen, daß Er zu leben habe. Solte Ihnen hierinfals etwas nicht anständig seyn, bitte gehorsambst mich dessen baldigst zu berichten, ich schmeichle mir durch mein bitt und Dero beckräfftigung in absehung Ihres Caracteurs bey Sr Durchl: etwas aus zu würcken, solte dieses nicht seyn, kan mir wegen der liebe des nächsten keine Schuld beygemessen werden. Der ich nebst anwünschung deren herannahenden Feuertägen, glücklichen aus und eingang des alt und neuen Jahr Ersterbe Meines hochgeEhrtisten Herrn Ergebenster Diener Joseph Haydn mppria. Eisenstadt den 22ten Decris / 1768","Nobly born, Highly respected Sir! I send you herewith my petition to His Highness, reading as follows: Your Serene Highness, etc. Your Illustrious and Serene Highness graciously gave me to understand, not long hence, that not only was the Rent Collector Frantz Nigst found superfluous as a violinist, but also Joseph Diezl as a member of the band; and moreover I was ordered to demand the 2 uniforms from the former. Concerning the former, i.e., Franz Nigst, I must respectfully persuade Your Highness, and admit myself candidly, that the second violin section in all the operas hitherto produced was, with him, in the best possible hands, because he is the only one capable of leading the seconds: therefore if he were dismissed, one would fear for the future on account of the mistakes which would creep in—that is, unless Your Highness were minded graciously to engage another permanent second violinist, or to have one come from Vienna when we produce operas. Because there are no other players for the seconds except the horn players Frantz and May, with whom one is really not properly equipped. It is true that if the whole band goes to Esterház next year, he could not be in Esterház permanently on account of the rent office, but nevertheless it is my humble opinion that he should be brought to Esterház when the Imperial and Royal Court, or other high dignitaries, are present there. I humbly ask Your Highness, moreover, graciously to allow him the yearly 50 Gulden, and also the Winter and Summer clothes (in which he has already seen service in Esterház). Joseph Dietzl [sic] is in my opinion especially necessary in the choir loft if the whole band goes off to Esterház, so that the customary church services can be held by him, his praeceptor and the boy choristers who are in his apprenticeship. I hear from many people that he cannot possibly support himself with his position as schoolmaster. I ask you humbly to grant him in your graciousness enough so that he can live. In case you find anything imprudent in the above, please kindly let me know of it at once. I flatter myself that through my petition and through your confirmation of it, something may have an effect on His Highness. Apart from wishing you best greetings for the coming Holidays, and a happy farewell to the old and welcome to the new year, I am, Highly respected Sir, your obedient servant, Joseph Haydn [m.] pria. Eisenstadt, 22nd December 1768.",
jhdoc0009,,record,"Haydn to Nikolaus I, Prince Esterházy, Eisenstadt, 22 December 1768",1768-12-22,"Joseph Haydn;Frantz Nigst;violinists;Joseph Diezl;orchestra personnel;tenor singers;Nikolaus I, Prince Esterházy;uniforms;operas;Vienna;Eisenstadt;Eszterháza;orchestral forces;salaries;baryton trios;hornists;Karl Franz;Johann May",Eisenstadt,47.840734,16.524253,"Bartha GBA no. 9; Landon CCLN, pp. 12-13",ger,"Autograph, Esterházy Archives Acta Musicalia I, 57","Durchl: Hochgeb: et: Eure hochfürstliche Durchl: haben mire jüngsthin gnädigst zu Wissen gemacht, daß nicht nur der alhiesige Räntmeister Frantz Nigst als Violinist, sonder nauch der Joseph Diezl als Tenorist bey der Music überflissig [sic] befunden worden, sonder nauch mir anbefohlen, von den ersteren die 2 Uniform absufordern: diesen ersteren nemlich Frantz Nigst betreffend, mus Euer Durchl: ich unterthänigst beybringen, und in Wahrheit gestehen, daß in denen bishero producirten opern bey den Violin Secund mit selben als den einzigen, so den Secund zu dirigiren in stand ist, bestens versehen ware, folglich, wan dieser abgethann wäre, künfftighin wegen unterlauffenden Fehlern in Forchten stund, es seye dan, daß etwan Eure Durchlaucht gnädigst gesonnen wären, einen anderen festen Secund geiger aufzu nehmen, oder zu producirenden opern einen von Wienn kommen zu lassen, dan zu den Secund ist sodan niemand als der Waldhornist Frantz und Mäy, mit denen führwahr nicht versehen wäre. Wahr ist es zwar, daß, wan die ganzte Music künfftiges Jahr nacher Esterhaz kommet, er wegen dem Räntamt nicht beständig in Esterhaz seyn könte, jedoch wäre meine unterthänigste Meinung, denselben (wan der K: K: Hof, oder andere hoche herschaften anwesend wären) nacher Esterhaz kommen zu lassen. Euer Durchl: demnach unterthänigst bitte, ihme noch ferners die Jährliche 50 Fl. Dan die Winter und Sommer Kleider (mit welche-letzteren er in Esterhaz scon dienste geleistet hat) gnädigst zu ertheillen. Der Joseph Dietzl ist meines erachtens auf den Chor besonders dazu mahlen nöthig, wan die gantze Music nach Esterhaz abgehet, damit der gewöhnliche Gottes dienst durch ihn, seinen preceptor, und seine in der lehr befindliche Singer buben bestritten würde. ich höre von mehreren, daß er mit dem schullmeister dienst allein ohnmöglich sich ernähren kan. bittete also eben unterthänigst ihme doch so vieles gnädigst aus zu werffen, daß Er zu leben habe. Nächste Tägen werde Euer hochfürstlichen durchlaucht einige neue Trio gehorsamst übermachen, der ich zu hohen Hulden und gnaden micht unterthänigst befehle. Euer hochfl. durchl. Unterthänigster Eisenstadt, den 22ten Decembris 1768. Josephus Haydn mppria.","Your Serene Highness, etc. Your Illustrious and Serene Highness graciously gave me to understand, not long hence, that not only was the Rent Collector Frantz Nigst found superfluous as a violinist, but also Joseph Diezl as a member of the band; and moreover I was ordered to demand the 2 uniforms from the former. Concerning the former, i.e., Franz Nigst, I must respectfully persuade Your Highness, and admit myself candidly, that the second violin section in all the operas hitherto produced was, with him, in the best possible hands, because he is the only one capable of leading the seconds: therefore if he were dismissed, one would fear for the future on account of the mistakes which would creep in—that is, unless Your Highness were minded graciously to engage another permanent second violinist, or to have one come from Vienna when we produce operas. Because there are no other players for the seconds except the horn players Frantz and May, with whom one is really not properly equipped. It is true that if the whole band goes to Esterház next year, he could not be in Esterház permanently on account of the rent office, but nevertheless it is my humble opinion that he should be brought to Esterház when the Imperial and Royal Court, or other high dignitaries, are present there. I humbly ask Your Highness, moreover, graciously to allow him the yearly 50 Gulden, and also the Winter and Summer clothes (in which he has already seen service in Esterház). Joseph Dietzl [sic] is in my opinion especially necessary in the choir loft if the whole band goes off to Esterház, so that the customary church services can be held by him, his praeceptor and the boy choristers who are in his apprenticeship. I hear from many people that he cannot possibly support himself with his position as schoolmaster. I ask you humbly to grant him in your graciousness enough so that he can live. In the next few days I will respectfully send YOUR ILLUSTRIOUS AND SERENE HIGHNESS some new trios, and I most humbly commend myself to your high favour and grace, YOUR ILLUSTRIOUS AND SERENE HIGHNESS’ most humble Joseph Haydn. Eisenstand, 22nd December 1768.",
